{
  "tool_version": "1.2.0",
  "demo_id": "window",
  "input_digest": "sha256:c08795a6a3c361a3339414c5a8441fb74c58f027c96931dbdc0da28560e132ac",
  "config_digest": "sha256:b02cfeb006b05c52f075c3aa454045cd4c46b25be5576e37e184c3f02bf9328b",
  "input_file_digests": {
    "data/raw/sample_events.jsonl": "sha256:6872d0676edc12d572875bec549fcb8b4cf813dbfc332ae4f014842d985a1e97"
  },
  "config_file_digests": {
    "configs/default.yaml": "sha256:89242ab3940666dc9d0f3bb6bb996b93a5c17908b8edb0844e539390bf555129"
  },
  "artifact_schema_versions": {
    "run_manifest": "run-manifest/v2",
    "telemetry_summary": "telemetry-summary/v1"
  },
  "execution_mode": "synthetic-local"
}
