{
  "tool_version": "1.2.0",
  "demo_id": "window",
  "input_digest": "sha256:e8771283a83c146a2cffce5fe316c1408200b6d7717cbb6d074334aa891672f3",
  "config_digest": "sha256:e7cb0264262cc997edf8f6b987dc0466098f23150d0c6204fb5fd7c245df1d7d",
  "input_file_digests": {
    "data/raw/richer_sample_events.jsonl": "sha256:8e17009ade71d1ab86f34c456a22c00ba37db3ccac43f25be8e75d27ed0a72e0"
  },
  "config_file_digests": {
    "configs/richer_sample.yaml": "sha256:db54cfe6d4bf241e0ee937c8c5ac90b98cce088e7b2f0533e7588e0d286d3273"
  },
  "artifact_schema_versions": {
    "run_manifest": "run-manifest/v1",
    "telemetry_summary": "telemetry-summary/v1"
  },
  "execution_mode": "synthetic-local"
}
