{
  "tool_version": "1.2.0",
  "demo_id": "dedup",
  "input_digest": "sha256:06c005b433bdc28f08cd6fdc7028c0242960b09f5187a723445f40bf135977a4",
  "config_digest": "sha256:aa18d8ca4edab237dcec5c23c1dc7e9433f23a7d156df5a592e353c6fc9b74ad",
  "input_file_digests": {
    "demos/rule-evaluation-and-dedup-demo/data/raw/sample_rule_hits.json": "sha256:a73d288a898bf0fe33e6455e17254be05d313d28e41981f792ebc7d81654309d"
  },
  "config_file_digests": {
    "demos/rule-evaluation-and-dedup-demo/config/dedup.yaml": "sha256:861ab0f793577c705f031ea0a0b58e9b90d569279cf6f1b947d091d49e6e2747"
  },
  "artifact_schema_versions": {
    "dedup_explanations": "dedup-explanations/v1",
    "dedup_rule_hits": "dedup-rule-hits/v1",
    "run_manifest": "run-manifest/v1"
  },
  "execution_mode": "synthetic-local"
}
