{
  "tool_version": "1.2.0",
  "demo_id": "config-change",
  "input_digest": "sha256:c7ee82071fa0ae47742c3241b20dd97e811df618757d008b99624b1afb686229",
  "config_digest": "sha256:c0db824d16bd1e23cb413e9d56ad6e1effa6168aea6c9ef3f8976118ff5a1d6e",
  "artifact_schema_versions": {
    "config_change_events": "config-change-events/v1",
    "config_investigation_hits": "config-investigation-hits/v1",
    "investigation_summary": "investigation-summary/v1",
    "run_manifest": "run-manifest/v1"
  },
  "execution_mode": "synthetic-local"
}
