{
  "tool_version": "1.2.0",
  "demo_id": "window",
  "input_digest": "sha256:0000000000000000000000000000000000000000000000000000000000000000",
  "config_digest": "sha256:1111111111111111111111111111111111111111111111111111111111111111",
  "artifact_schema_versions": {
    "run_manifest": "run-manifest/v1"
  },
  "execution_mode": "synthetic-local"
}
