{
  "tool_version": "1.2.0",
  "demo_id": "window",
  "input_digest": "sha256:0000000000000000000000000000000000000000000000000000000000000000",
  "config_digest": "sha256:1111111111111111111111111111111111111111111111111111111111111111",
  "input_file_digests": {
    "data/raw/events.jsonl": "sha256:2222222222222222222222222222222222222222222222222222222222222222"
  },
  "config_file_digests": {
    "configs/window.yaml": "sha256:3333333333333333333333333333333333333333333333333333333333333333"
  },
  "artifact_schema_versions": {
    "run_manifest": "run-manifest/v2"
  },
  "execution_mode": "synthetic-local"
}
